<?xml version="1.0" encoding="UTF-8"?>
<!ELEMENT asignatura (titulo+, tema+)>
<!ELEMENT titulo (#PCDATA)>
<!ELEMENT tema (lecciones+) >
<!ATTLIST tema titulo CDATA #REQUIRED>
<!ELEMENT lecciones (leccion+)>
<!ELEMENT leccion (#PCDATA)>
<!ATTLIST leccion titulo CDATA #REQUIRED>